{
  "$schema": "https://json-schema.org/draft/2020-12/schema",
  "title": "Cadence task import v1",
  "type": "object",
  "required": ["schema_version", "idempotency_key", "tasks"],
  "additionalProperties": false,
  "properties": {
    "schema_version": {
      "type": "string",
      "const": "1.0"
    },
    "idempotency_key": {
      "type": "string",
      "minLength": 1,
      "maxLength": 180
    },
    "source": {
      "type": "string"
    },
    "week": {
      "type": "string",
      "pattern": "^\\d{4}-W\\d{2}$"
    },
    "tasks": {
      "type": "array",
      "minItems": 1,
      "items": {
        "type": "object",
        "required": ["title"],
        "additionalProperties": false,
        "properties": {
          "title": {
            "type": "string",
            "minLength": 1,
            "maxLength": 240
          },
          "description": {
            "type": "string"
          },
          "column": {
            "type": "string"
          },
          "tags": {
            "type": "array",
            "items": {
              "type": "string"
            }
          },
          "priority": {
            "type": "string",
            "enum": ["low", "normal", "high"]
          },
          "due_at": {
            "type": "string"
          },
          "evidence_url": {
            "type": ["string", "null"]
          },
          "reminder_enabled": {
            "type": "boolean"
          },
          "external_ref": {
            "type": "string"
          }
        }
      }
    }
  }
}
